{
    "$schema": "https://raw.githubusercontent.com/rroodll/QB-Estimate-Reporting/main/schema/resource_estimate_schema.json",
    "id": "ec0baf59-05f5-49df-b5e5-8f887d822a10",
    "name": "h2_s_0",
    "category": "industrial",
    "size": "62_orbitals",
    "task": "ground_state_energy_estimation",
    "implementation": "Double factorized QPE resource estimates based on methodology of arXiv:2406.06335. Note that the truncation error is not included in the error bounds and that the SCF compute time is not included in the preprocessing time. Ground-state overlap is taken to be that estimated for the dominant CSF as estimated by DMRG and that this DMRG runtime is not included in the classical compute costs.",
    "value": 0.0,
    "value_ci": [
        0.0,
        0.0
    ],
    "circuit_repetitions_per_calculation": 9,
    "calculation_repetitions": 1,
    "total_circuit_repetitions": 9,
    "runtime_requirement": 86400,
    "logical-abstract": {
        "num_qubits": 2034,
        "t_count": 851752520064
    },
    "value_per_t_gate": 0.0
}