{
  "$schema": "https://raw.githubusercontent.com/rroodll/QB-Estimate-Reporting/main/schema/resource_estimate_schema.json",
  "id": "Rigetti-USC-FH-N_5-t_0.1",
  "name": "Fermi-Hubbard",
  "category": "scientific",
  "size": "5 x 5, time=0.1",
  "task": "time_independent_dynamics",
  "implementation": "QAE using QSVT w/ PauliLCU FH Encoding",
  "value": 0,
  "value_per_t_gate": 0,
  "circuit_repetitions_per_calculation": 104676,
  "calculation_repetitions": 100,
  "total_circuit_repetitions": 10467600,
  "runtime_requirement": 8640000,
  "logical-abstract": {
    "num_qubits": 72,
    "t_count": 20,
    "clifford_count": 13
  },
  "logical-compiled": {
    "logical_architecture_description": "Multiple module ladder",
    "num_qubits": 260,
    "t_count": 1709820,
    "num_t_factories": 4,
    "clifford_count": 610758,
    "t_depth": 6577
  },
  "physical": {
    "physical_architecture_description": "1M Qubit superconducting transmon lattice",
    "code_name": "surface",
    "code_distance": 31,
    "runtime": 466.2599545,
    "num_qubits": 6513840,
    "t_count": 1709820,
    "num_t_factories": 4,
    "num_factory_qubits": 535368
  }
}