{
  "$schema": "https://raw.githubusercontent.com/rroodll/QB-Estimate-Reporting/main/schema/resource_estimate_schema.json",
  "id": "FH 64x64 Square (U/J = 4.0)",
  "name": "Fermi-Hubbard",
  "category": "scientific",
  "size": "64 x 64",
  "task": "time_independent_dynamics",
  "implementation": "QET w/ Linear-T FH Encoding",
  "value": 50000000.0,
  "value_ci": [50e5, 50e7], 
  "value_per_t_gate": 1.30e-5,
  "circuit_repetitions_per_calculation": 100,
  "calculation_repetitions": 10,
  "total_circuit_repetitions": 1000,
  "runtime_requirement": 115200,  
    "logical-abstract": {
    "num_qubits": 8224,
    "t_count": 3855739870,
    "clifford_count": 19591746347
  }
}